{
  "v": 1,
  "id": "01demo_want_monitor01",
  "type": "want",
  "ts": "2026-07-25T02:00:00Z",
  "from": {
    "id": "demo_buyer_ada",
    "display": "Ada",
    "roles": ["buyer"]
  },
  "to": null,
  "thread": null,
  "reply_to": null,
  "ttl_sec": 172800,
  "body": {
    "item": {
      "title": "二手 24寸 1080p 显示器",
      "description": "办公用，接口 HDMI 即可",
      "qty": 1,
      "condition": "used",
      "tags": ["monitor", "1080p"]
    },
    "budget": { "amount": "500", "currency": "CNY" },
    "where": { "region": "上海-浦东", "privacy": "after_deal" },
    "need_courier": false,
    "notes": "可自取，工作日晚上"
  },
  "sig": null
}
